{
  "feature_version": "v2",
  "bucket_end": "2026-03-24T10:01:00Z",
  "predicted_bucket_end": "2026-03-24T10:02:00Z",
  "target": {
    "scope": "system",
    "endpoint": ""
  },
  "history_rps": [55, 58, 61, 64, 62, 70],
  "features": {
    "rolling_mean_5": 63.0,
    "rolling_std_5": 4.2,
    "hour_of_day": 10,
    "day_of_week": 1
  }
}
